{
  "schema_version": "suite-qa-receipt.v1",
  "generated_at": "2026-06-03T00:00:02Z",
  "manifest": "docs/sample-report-pack/ready-for-handoff/suite-manifest.json",
  "manifest_size_bytes": 8645,
  "manifest_sha256": "dfb8cd25167164d8d0217009c3abfd72df7ac6667a1a099175791525b0dee7fe",
  "run_id": "ready-for-handoff-sample-run",
  "suite": "ready-for-handoff-suite",
  "model": "mock:test-model",
  "run_environment": {
    "forgedan_version": "1.2.0",
    "python_version": "3.11.0",
    "python_implementation": "CPython",
    "platform": "fixture-platform",
    "os": "fixture-os"
  },
  "status": "passed",
  "valid": true,
  "artifact_count": 20,
  "schema_validation_count": 7,
  "error_count": 0,
  "errors": [],
  "acceptance": {
    "manifest_valid": true,
    "artifacts_valid": true,
    "schemas_valid": true,
    "report_acceptance_status": "passed",
    "report_acceptance_criteria": 3,
    "ready_for_handoff": true
  },
  "cross_artifact_consistency": {
    "valid": true,
    "error_count": 0,
    "errors": [],
    "checked_artifacts": [
      "suite-result.json",
      "suite-report.md",
      "suite-report.html",
      "suite-report-redacted.md",
      "suite-report-redacted.html",
      "suite-cases.jsonl",
      "suite-evidence.csv",
      "suite-case-matrix.csv",
      "suite-config.json",
      "suite-preflight.json",
      "suite-preflight.md",
      "suite-risk-register.json",
      "suite-risk-register.csv",
      "suite-coverage.json",
      "suite-coverage.csv",
      "suite-release-notes.md",
      "suite-report-bundle.md",
      "suite-public-bundle.md",
      "suite-result-redacted.json",
      "suite-cases-redacted.jsonl"
    ]
  },
  "handoff_readiness": {
    "status": "passed",
    "score": 1.0,
    "required_items": 16,
    "passed": 16,
    "failed": 0,
    "review_required": 0,
    "blockers": []
  },
  "handoff_checklist": [
    {
      "id": "manifest-verified",
      "title": "Integrity manifest verified",
      "status": "passed",
      "required_for_handoff": true,
      "evidence": "suite-manifest.json schema validation passed",
      "action": "Attach the manifest and keep it with the report pack."
    },
    {
      "id": "artifact-integrity",
      "title": "Artifact checksums verified",
      "status": "passed",
      "required_for_handoff": true,
      "evidence": "20 artifacts checked for existence, size, and SHA256",
      "action": "Re-run verify-bundle after copying or archiving the pack."
    },
    {
      "id": "schema-contracts",
      "title": "Schema contracts validated",
      "status": "passed",
      "required_for_handoff": true,
      "evidence": "suite-config, suite-coverage, suite-manifest, suite-preflight, suite-result, suite-risk-register",
      "action": "Validate JSON artifacts before reviewer handoff."
    },
    {
      "id": "cross-artifact-consistency",
      "title": "Cross-artifact consistency verified",
      "status": "passed",
      "required_for_handoff": true,
      "evidence": "checked=suite-result.json, suite-report.md, suite-report.html, suite-report-redacted.md, suite-report-redacted.html, suite-cases.jsonl, suite-evidence.csv, suite-case-matrix.csv, suite-config.json, suite-preflight.json, suite-preflight.md, suite-risk-register.json, suite-risk-register.csv, suite-coverage.json, suite-coverage.csv, suite-release-notes.md, suite-report-bundle.md, suite-public-bundle.md, suite-result-redacted.json, suite-cases-redacted.jsonl; errors=0",
      "action": "Resolve mismatched run IDs or report counts before handoff."
    },
    {
      "id": "release-notes",
      "title": "Release notes reviewed",
      "status": "passed",
      "required_for_handoff": true,
      "evidence": "suite-release-notes.md",
      "action": "Review suite-release-notes.md before final report sign-off."
    },
    {
      "id": "preflight-readiness",
      "title": "Suite preflight readiness reviewed",
      "status": "passed",
      "required_for_handoff": true,
      "evidence": "suite-preflight.json status=passed; score=1.0000; blockers=None; artifacts=suite-preflight.json, suite-preflight.md",
      "action": "Keep suite-preflight.json and suite-preflight.md with the report pack."
    },
    {
      "id": "source-inventory",
      "title": "Imported source inventory reviewed",
      "status": "passed",
      "required_for_handoff": true,
      "evidence": "sources=0; generated_cases=0; total_size_bytes=0",
      "action": "Review imported source paths, SHA256 values, and generated case counts before sign-off."
    },
    {
      "id": "coverage-review",
      "title": "Coverage artifacts reviewed",
      "status": "passed",
      "required_for_handoff": true,
      "evidence": "suite-coverage.json, suite-coverage.csv",
      "action": "Review case-category, policy-domain, OWASP LLM, and coverage-gap summaries before sign-off."
    },
    {
      "id": "redacted-publication-pack",
      "title": "Redacted publication pack present",
      "status": "passed",
      "required_for_handoff": true,
      "evidence": "suite-result-redacted.json, suite-cases-redacted.jsonl, suite-report-redacted.html, suite-report-redacted.md, suite-public-bundle.md",
      "action": "Use the redacted/public artifacts for lower-sensitivity sharing."
    },
    {
      "id": "raw-artifact-handling",
      "title": "Raw artifact handling reviewed",
      "status": "passed",
      "required_for_handoff": true,
      "evidence": "acceptance_criteria.raw-artifact-handling: Raw prompts and responses restricted to authorized reviewers.",
      "action": "Restrict raw prompts, responses, and evidence to authorized reviewers."
    },
    {
      "id": "policy-gate",
      "title": "Policy gate reviewed",
      "status": "passed",
      "required_for_handoff": true,
      "evidence": "suite-result.json policy_passed=true",
      "action": "Resolve failed policy gates or document accepted risk."
    },
    {
      "id": "review-decisions",
      "title": "Reviewer decisions documented",
      "status": "passed",
      "required_for_handoff": true,
      "evidence": "decisions=0; policy_violations=0",
      "action": "Document accepted risk, mitigation requirements, or rejection decisions for policy exceptions."
    },
    {
      "id": "risk-owner-assignment",
      "title": "Risk register owners and due dates assigned",
      "status": "passed",
      "required_for_handoff": true,
      "evidence": "risks=0; assigned_owners=0; due_dates=0",
      "action": "Assign owners and due dates for open report risks before handoff."
    },
    {
      "id": "residual-risk-owner-signoff",
      "title": "Residual risk owner sign-off recorded",
      "status": "passed",
      "required_for_handoff": true,
      "evidence": "acceptance_criteria.residual-risk-owner-signoff: No open residual risks require exception approval for this sample.",
      "action": "Record residual risk owner sign-off or accepted risk evidence before handoff."
    },
    {
      "id": "acceptance-criteria",
      "title": "Report acceptance criteria reviewed",
      "status": "passed",
      "required_for_handoff": true,
      "evidence": "criteria=3; status=passed",
      "action": "Resolve failed acceptance criteria before report handoff."
    },
    {
      "id": "limitations-reviewed",
      "title": "Limitations reviewed",
      "status": "passed",
      "required_for_handoff": true,
      "evidence": "acceptance_criteria.limitations-reviewed: Report limitations match the scoped assessment.",
      "action": "Confirm limitations match the assessment scope before sign-off."
    }
  ],
  "checked_artifacts": [
    {
      "path": "suite-result.json",
      "sensitivity": "restricted",
      "audience": "authorized_reviewers",
      "exists": true,
      "size_bytes": 16770,
      "expected_size_bytes": 16770,
      "sha256": "be9d3dc1d4956cd875cf62da38d66745b3be3b4292a9111dec8db385f74aa036",
      "expected_sha256": "be9d3dc1d4956cd875cf62da38d66745b3be3b4292a9111dec8db385f74aa036",
      "valid": true,
      "errors": []
    },
    {
      "path": "suite-cases.jsonl",
      "sensitivity": "restricted",
      "audience": "authorized_reviewers",
      "exists": true,
      "size_bytes": 1448,
      "expected_size_bytes": 1448,
      "sha256": "e9647b6e7e447fa11454aae637414fe8deb7481c469588574eb29750d5f096a6",
      "expected_sha256": "e9647b6e7e447fa11454aae637414fe8deb7481c469588574eb29750d5f096a6",
      "valid": true,
      "errors": []
    },
    {
      "path": "suite-evidence.csv",
      "sensitivity": "restricted",
      "audience": "authorized_reviewers",
      "exists": true,
      "size_bytes": 232,
      "expected_size_bytes": 232,
      "sha256": "4a83ed85fab8e7bfad546190e313377de52b028b9e3f867bc994fcafe63a9f96",
      "expected_sha256": "4a83ed85fab8e7bfad546190e313377de52b028b9e3f867bc994fcafe63a9f96",
      "valid": true,
      "errors": []
    },
    {
      "path": "suite-case-matrix.csv",
      "sensitivity": "public",
      "audience": "external_reviewers",
      "exists": true,
      "size_bytes": 914,
      "expected_size_bytes": 914,
      "sha256": "f47849e890deea974b0553868e25f8966dab04c9f652333a14df3b0ceae64b24",
      "expected_sha256": "f47849e890deea974b0553868e25f8966dab04c9f652333a14df3b0ceae64b24",
      "valid": true,
      "errors": []
    },
    {
      "path": "suite-risk-register.json",
      "sensitivity": "internal",
      "audience": "assessment_team",
      "exists": true,
      "size_bytes": 244,
      "expected_size_bytes": 244,
      "sha256": "cf130b8ac581b36b3123ccd8b6a3c922c8ab967d0c0412d8e54cfc3fbf0cc6ef",
      "expected_sha256": "cf130b8ac581b36b3123ccd8b6a3c922c8ab967d0c0412d8e54cfc3fbf0cc6ef",
      "valid": true,
      "errors": []
    },
    {
      "path": "suite-risk-register.csv",
      "sensitivity": "internal",
      "audience": "assessment_team",
      "exists": true,
      "size_bytes": 223,
      "expected_size_bytes": 223,